22. november 2019, 14:17	https://www.postimees.ee/6832683/kohus-moistis-mehele-gaasi-nakku-lasknud-ja-ta-metsa-jatnud-korrakaitsjad-tingimisi-vangi	Postimees	Kohus mõistis mehele gaasi näkku lasknud ja ta metsa jätnud korrakaitsjad tingimisi vangi Täiendatud ja täpsustatud kell 16.20	Andrei Kirillov (esiplaanil) ning Gleb Volodin Viru maakohtus. FOTO: Erik Kalda / Põhjarannik Viru maakohus mõistis täna tingimisi vanglakaristuse politseinikule ja abipolitseinikule, kes viisid Jõhvi noormehe kahe aasta eest metsa, lasid talle gaasi näkku ning sõitsid minema. Kohus mõistis 44-aastase politseiniku Andrei Kirillovi ja 23-aastase abipolitseiniku Gleb Volodini süüdi võimuliialduses. Volodinile mõistis kohus kaks ja Kirillovile kolm aastat tingimisi vangistust. Volodini katseaeg kestab kaks ja pool ning Kirillovi oma kolm ja pool aastat. Sündmused said alguses 2017. aasta 4. aprilli õhtul Jõhvis Coopi kaupluses, kus politseinikud pidasid kinni 26-aastase alkoholijoobes Allani. Noormehele tehti ka narkootikumide kiirtest, mis tuvastas et ta oli suitsetanud kanepit. Korrakaitsjad koostasid mehele väärteoprotokolli. Seejärel paigutasid nad ta autosse ja viisid linnast välja metsa. Auto peatudes tõmbas politseinik ta autost välja ning lasi talle gaasi näkku. Noormees tundis silmades teravat valu ja tal hakkasid pisarad voolama. Ta kaotas ajutiselt nägemisvõime ja orientatsiooni. Politsei partullekipaaž sõitis seejärel sündmuskohalt minema. Politseiautosse jäid Allani jope ja mobiiltelefon. Viru ringkonnaprokuratuur märkis süüdistuses, et politseinikud jätsid inimese abitus seisundis metsa. Allan oli alkoholi- ja narkojoobes, gaasirelva toimel tugevalt häiritud nägemisvõimega ning ilma mobiiltelefoni ja jopeta. Kuna oli juba õhtune aeg ja väljas pime, eksis Allan ära ega osanud metsast välja tulla. Ta heitis õhukestes rõivastes maapinnale pikali, kuid ei jäänud külma tõttu magama. Kokku veetis ta metsas üle üheksa tunni: politseinikud jätsid ta maha kell 20.50 ning metsast jõudis ta välja alles järgmisel hommikul kell 6. Metsas viibimise ajal oli Jõhvi vallas õhutemperatuur vahemikus +2,1 kuni +5 kraadi Celsiuse järgi. Prokuratuur leidis, et Kirillov pani toime võimuliialduse, asetas teise inimese eluohtlikku ja tema tervist raskelt kahjustada võivasse olukorda ja võttis noormehelt alusetult vabaduse. Volodinit süüdistas prokurör võimuliialduses ning teise inimese eluohtlikku ja tema tervist raskelt kahjustada võivasse olukorda asetamises ja jätmises. Kirillov ja Volodin ise ennast süüdi ei tunnistanud ning nende versioon juhtunust erineb kannatanu omast oluliselt. Politsei sisekontrolli uurimine siiski kinnitas võimuliialdust ning leidis, et Allan räägib tõtt. Kohtuotsus pole jõustunud ning seda on õigus edasi kaevata seitsme päeva jooksul. Viru ringkonnaprokuratuur ei ole veel otsustanud, kas kaebab otsuse edasi. «Tänane kohtuotsus on süüdimõistev, kuid karistus erineb mõnevõrra sellest, mida taotles prokuratuur. Otsustame edasikaebamise pärast kohtuotsuse motiividega tutvumist. Prokuratuur on rahul sellega, et isikud tunnistati süüdi neile ette heidetud kuritegu. Politseiteenistuses ei saa töötada inimesed, kes ei järgi seaduse piire ning astuvad nendest üle,» ütles Viru ringkonnaprokuratuuri ringkonnaprokurör Mari Luuk. Süüdistatavate kaitsjad Kaido Kooga ja Robert Sprengk ütlesid BNSile, et vaidlustavad süüdimõistva otsuse kindlasti Tartu ringkonnakohtus ja taotlevad oma kaitsealuste õigeks mõistmist. Politsei- ja piirivalveameti pressiesindaja Kristina Kostina ütles Postimehele, et praegu Kirillov ja Volodin enam politseis ei tööta. 	Postimees	Andres Einmann	1	4
22. november 2019, 14:12	https://tervis.postimees.ee/6832473/teadlased-enamik-inimesi-kaib-liiga-tihti-dusi-all	Postimees	Teadlased: enamik inimesi käib liiga tihti duši all	Liiga sage pesemine võib olla kahjulik. FOTO: Shutterstock Rohkem kui kolm neljandikku inimestest käib iga päev duši all, kuid teadlaste sõnul ei ole nii sage pesemine tegelikult vajalik. Iga päev duši all käimine on mõistlik vaid siis, kui inimene teeb iga päev trenni või rasket füüsilist tööd ning higistab palju. Tegelikult ei vaja nahk ega juuksed iga päev pesemist ning liigne kokkupuude kuuma vee ja kehahooldustoodetega võib olla hoopis kahjulik. Ekspertide sõnul on iga päev duši all käimine osalt kehahooldustoodete rohke reklaamimise tõttu välja kujunenud trend, millel puudub teaduslik alus. Tervise seisukohast ei ole igapäevasel pesemisel kasutegureid, vastupidi, liigne pesemine ja kehahooldustoodete kasutamine võib hoopis kahjulikult mõjuda. Inimese nahal on heade bakterite ja rasu kiht, mis kaitseb nahka ja säilitab niiskust ja pehmust. Liiga sage kuuma vee ja seebiga pesemine kahjustab naha loomulikku tasakaalu ning selle tagajärjel võib tekkida naha kuivus, ärritus ja ketendus. Samuti vähendab see naha võimet organismi allergeenide ja halbade bakterite eest kaitsta ning suureneb infektsioonide risk. Vältida tuleks antibakteriaalseid seepe ja dušigeele, sest need hävitavad ühes halbade bakteritega ka head bakterid, mis on vajalikud immuunsüsteemi toimimiseks. Samuti on organismile kahjulik liiga sage kokkupuude kehahooldustoodetega, millest paljud sisaldavad ohtlikke kemikaale. Paljud šampoonid ja dušigeelid sisaldavad raskmetalle, sulfaate ja parabeene, mis pärsivad endokriinsüsteemi toimimist ja häirivad hormonaaltasakaalu. Teadlased hoiatavad, et mitmed ilutoodetes leiduvad kemikaalid võivad suurendada ka vähi riski. Seetõttu tuleks eelistada looduslikke kehahooldustooteid ning mitte käia duši all lihtsalt harjumusest, vaid siis, kui selleks on tegelik vajadus. 	Tervis	Lilian Laanepere	0	45
22. november 2019, 13:57	https://maailm.postimees.ee/6832657/usa-justiitsminister-epsteini-surmast-taiuslik-tuksikeeramiste-torm	Postimees	USA justiitsminister Epsteini surmast: «täiuslik tuksikeeramiste torm»	Seksuaalkuritegudes süüdistatud ärimees Jeffrey Epstein USA kohturuumis. FOTO: Jane Rosenburg / Reuters / Scanpix USA justiitsminister William Barr ütles usutluses Associated Pressile, et tal olid seksuaalkuritegudes süüdistatud ärimehe Jeffrey Epsteini surma suhtes esialgu kahtlused, kuid nüüdseks on ta jõudnud järeldusele, et enesetapp tugevate turvameetmetega vanglas oli arvukate vigade tulemus. Barri sõnul tekitas temas kahtlusi mitme reegli rikkumine Manhattani vanglas. Kui FBI ja justiitsministeerium asja uurisid, ilmnes rida vigu, mis andsid Epsteinile võimaluse endalt elu võtta. Epstein (66) leiti 10. augusti varahommikul New Yorgis asuvast föderaalvanglast surnuna. Kohtuekspertiisi põhjal poos ta end oma kongis voodilinaga üles. Barr ütles, et mõistab neid, kelle mõte läks kohe «halvimale stsenaariumile», sest toimunut võib kirjeldada «täiusliku tuksikeeramiste tormina». Mõne päeva eest esitati Epsteini valvamise eest vastutanud töötajatele süüdistus vangladokumentide võltsimises. Ohvitserid Tova Noel ja Michael Thomas magasid ning tegelesid oma valvekorra ajal internetist mööbli ja mootorrataste ostmisega, ehkki pidanuks Epsteini iga poole tunni tagant kontrollima. Epsteini süüdistati alaealiste tüdrukute seksuaalses ärakasutamises ja kupeldamises 2000. aastate algul, teda ähvardas 45-aastane vanglakaristus. Tema surm tõi tähelepanu keskmesse föderaalse vanglaameti, mis on hädas kroonilise personalinappuse ja vägivallapuhangutega. Sel nädalal vanglatöötajatele esitatud süüdistus näitab, et vanglas, mis peaks olema rangeimate julgeolekumeetmetega, ei pööratud turvalisusele vajalikku tähelepanu. 	Maailm	AP / BNS	0	0
22. november 2019, 13:55	https://elu24.postimees.ee/6832652/kuidas-soome-ehitustoolised-rebase-plindrist-paastsid	Postimees	Kuidas Soome ehitustöölised rebase plindrist päästsid	Rebane. Pilt on illustreeriv FOTO: Pexels / CC0 Licence Soome Turu Yliopistonmäe ehitusplatsi töömehed leidsid 20. novembril rebase, kes oli jäänud torusse kinni.  Käivitati rebase päästeoperatsioon, mis kestis umbes 15 minutit, teatab yle.fi. «Rebane oli torusse roninud, kuid kuna toru on väga libe, siis ei saanud ta enam sealt välja,» teatas seal töömaal tegutseva firma Elementtiasennus Oy esindaja Tom Tapani Outinen. Rebane üritas end ise päästa, pistes suure toru küljel olevast august pea välja, kuid keha ei mahtunud sellest läbi. Ehitustöölised nuputasid, kuidas plindris rebane päästa ja nad leidsid lahenduse. Töömehed tõstsid toru püsti, et rebane libiseks ühest otsast välja ja nii juhtuski. «Me saime torusse, milles oli ka vihmavett, kinni jäänud rebase kätte. Kui me ei oleks rebast märganud, oleks ta võinud eluga hüvasti jätta,» lisas Outinen. Töömeeste sõnul oli torust pääsenud rebane ärritunud ja selle tõttu arvavad nad, et loom oli torus pikka aega. Päästetud rebane nuusutas oma «vanglat», raputas karva kohevaks ja lahkus siis ehitusplatsilt. Üks töömees suunas rebase platsilt minema. Pilte ja videot vaata siit. 	Elu24	Inna-Katrin Hein	0	9
22. november 2019, 13:55	https://tartu.postimees.ee/6832425/politsei-leidis-tartus-kadunud-oe-ja-venna-raplamaalt	Postimees	Politsei leidis Tartus kadunud õe ja venna Raplamaalt	Pilt on illustratiivne. FOTO: Kristjan Teedema Politsei annab teada, et Tartus omavoliliselt kodust lahkunud venna ja õe, 10-aastase Heiro ja 12-aastase Mariie-Eliise asukoht on kindlaks tehtud. Lapsed leiti Raplamaalt aadressilt, mida politsei ei täpsusta. Nendega on kõik korras. Lastekaitsjad selgitavad juhtunu üksikasju, lapsed tuuakse peagi tagasi Tartusse. 	Tartu Postimees	Tartu Postimees	4	1259
22. november 2019, 13:53	https://elu24.postimees.ee/6832639/kuldvillaku-erisaade-on-puhendatud-admiral-bellingshauseni-polaarmatkale	Postimees	«Kuldvillaku» erisaade on pühendatud Admiral Bellingshauseni polaarmatkale	«Kuldvillaku» erisaade FOTO: Raul Mee Pühapäeval kell 19.30 näeb Kanal 2 ekraanil mälumängu «Kuldvillak» erisaadet, mis on pühendatud Antarktika avastamise kahesajandale aastapäevale järgmise aasta jaanuaris. Erisaates mängivad Marko Mihkelson, Heiti Hääl ja Jaanus Rohumaa. 200 aastat tagasi avastas Saaremaalt pärit baltisakslane Vene admiral Fabian Gottlieb von Bellingshausen Antarktise. See on Eesti mereajaloo üks olulisemaid sündmusi, mille väärikaks tähistamiseks korraldavad SA Eesti Meremuuseum ja MTÜ Thetis Ekspeditsioonid polaarteadusliku mereretke. 11. juulil 2019 alanud polaarretk heiskas purjed Kroonlinnas, nagu ka 200 aastat tagasi, et jõuda Antarktikasse selle avastamise päeval, 28. jaanuaril 2020. «Kuldvillaku» erisaates osalevad mängijad Marko Mihkelson, Heiti Hääl ja Jaanus Rohumaa on kõik ühel või teisel moel polaarretkega seotud. Saatejuht Eeva Esse tegi kaasa etapi Lissabon-Madeira ning on ka «Admiral Bellingshauseni» ristiema. Bellingshauseni ristiema Eeva Esse FOTO: Raigo Pajula Eeva lõi sarnaselt Amundsenile jääkamaka katki sõnadega: «Sa oled määratud jääs sõitmiseks ja veedad seal oma parima aja ja seal täidad ka oma ülesanded. Kuulsa maadeavastaja järgi ristin Sind Admiral Bellingshauseniks». Pühapäevases erisaates esitatavad küsimused on seotud meretemaatikaga ning maateaduste ja polaarteemadega. Kes mängis kalalaeva kaptenit menufilmis «Täiuslik torm»? Milliselt Donald Trumpi lemmiksaarelt pärines tõenäoliselt Titanicu hukutanud jäämägi? Kes ekspeaministritest on talvitunud Antarktikas? Kes juhtis esimesena Lõunapoolusele jõudnud ekspeditsiooni? Saatest käib läbi veel teisigi üllatavaid ja huvitavaid, kuulsaid ja kummalisi teemasid. Põnevat nuputamist ja uusi teadmisi leiavad kõik televaatajad. «Kuldvillaku» Admiral Bellingshauseni erisaade on Kanal 2-s pühapäeval kell 19.30, kohe pärast uudistemagasini «Reporter +». 	Elu24	Elu24.ee	0	0
22. november 2019, 13:48	https://sport.postimees.ee/6832634/treeningutel-ule-pingutanud-tomingas-voib-olla-on-mingi-jama-aga-muretsemiseks-pole-pohjust	Postimees	Treeningutel üle pingutanud Tomingas: võib-olla on mingi jama, aga muretsemiseks pole põhjust Tomingase, Oja, Gaimi ja Talihärma mõtted	Tuuli Tomingas laskesuusatamise hooajaeelsel pressikonverentsil. FOTO: Tairo Lutter Laskesuusatamise MK-sarja uus hooaeg algab järgmisel nädalal Rootsis Östersundis. Eelmisel hooajal suure sammu edasi teinud eestlannadel on suured sihid, aga kõik naised märkisid, et hooaja algus võib tulla keeruline, sest selja taga on raske treeningtsükkel. Tippvorm on suunatud veebruari keskpaigaks, kui Itaalias Antholz-Anterselvas toimuvad maailmameistrivõistlused. Seejärel leiavad Otepääl aset lahtised Euroopa meistrivõistlused, kus eestlannadel on samuti plaanis startida ja konkurentsis olla. Allpool on Eesti naislaskesuusatajate ja koondise peatreener Indrek Tobrelutsu mõtted hooajaeelselt pressikonverentsilt. Pressikonverentsil polnud Meril Beilmanni ning IBU karikasarjas osalevaid Kadri Lehtlat ja Susan Külma. Tuuli Tomingas: «Ma pean kahjuks tõdema, et minu seisund ei ole kõige parem. Ilmselt pingutasin viimastel treeningutel üle. Suvel oli väga suur tuhin. Võib-olla on mingisugune jama, aga ootame vereproovi vastused ära. Õnneks on maailmameistrivõistlusteni kolm kuud aega. Muretsemiseks pole põhjust. Kui on mingisugune jama, siis tuleme sellest välja. Esimesed etapid on olukorraga kohanemine. Kahjuks ei ole võimalik kogu talv tippvormis olla, vaid peab selle ajastama maailmameistrivõistlusteks. Esimene etapp on pigem lahti sõitmine – läheme küll maksimumi andma, aga peame endale aru andma, et võib-olla me pole hooaja algul eesotsas.» Regina Oja: «Ma olen oma hooaegadele tagasi vaadates aru saanud, et hooaja alguses on käimasaamine vaevarikas. Enne tänavust hooaega seadsin endale eesmärgi, et minu algbaas oleks tugevam ja parima vormi ajastan veebruariks. Sellest hoolimata soovin, et kehvem tase oleks piisavalt hea ja konkurentsivõimeline, et ka hooaja alguses ennast realiseerida ja kevadel ei oleks tunnet, et detsember oli nõrk.» Minu jaoks on Otepääl toimuvad Euroopa meistrivõistlused sama tähtsad kui maailmameistrivõistlused. See, et need üksteisele otsa tulevad, on positiivne. Ma loodan ja arvan, et järjest võistlemine sobib mulle paremini kui vahepeal puhkamine. Tuleme koju, kus on kodurajad ja kodupublik, kes innustab meid kiiremini sõitma.» Grete Gaim: «Minu vormi on raske hinnata, sest pole maailmaga konkureerinud, kuid võin öelda, et võrreldes eelmiste suvedega on minu vormikõver liikunud ülespoole. Eelnevatel hooaegadel olen suve lõpus ja sügisel heas hoos olnud, aga detsembriks väsinud. Nüüd on teistmoodi. Enne viimaseid laagreid olin mitte eriti heas hoos ja kui Beitostöleni laagrit arvestada, siis on vormikõver liikunud ülespoole. Maailmameistrivõistlused on alles kolme kuu pärast.» «Mind paneks õnnelikult tundma, kui sel suvel ja sügisel ning eelnevatel aastatel tehtud töö saaks realiseeritud. See peaks väljenduma sõidukiiruses, laskekiiruses ja lasketäpsuses. Soovin teha suurt sammu edasi, kuid tulemustes on seda keeruline öelda, sest juba eneseületus on ühele sportlasele oluline samm. Tuleb keskenduda väiksematele asjadele.» Johanna Talihärm laskesuusatamise hooajaeelsel pressikonverentsil. FOTO: Tairo Lutter Johanna Talihärm: «Minu tänavune ettevalmistus on kulgenud paremini kui eelmisel neljal-viiel aastal. Sügisel sain korralikult treenida, aga ka puhata ja taastuda. Varem tuli kooliga kompromisse teha. Kõik asjad, mis teha tahtsin, said tehtud. Mul oli septembris-oktoobris väike külmetus, kuid pikas perspektiivis see ei mõjuta hooaega. Mul on hooaja alguses enda käimasaamisega probleeme ja osalen Norras toimuval IBU karikasarja etapil.» Koondise peatreener Indrek Toberluts eesmärkidest: «Läheme iga võistlusega aina paremaks. Kui eelmisel hooajal said naised maailmameistrivõistlustel teatesõidus 12. koha, siis sel hooajal võiks see number olla ühekohaline, aga praegu on vara selliseid prognoose teha. Vaatame, kuidas hooaeg liikvele läheb. Oleme selleks võimelised, aga on muud tegurid, mis tulemusi mõjutavad.» 	Sport	Kris Ilves	0	0
22. november 2019, 13:47	https://elu24.postimees.ee/6832366/armas-lugu-noor-mees-aitas-hulkuma-lainud-koera-taas-koju	Postimees	Armas lugu: noor mees aitas hulkuma läinud koera taas koju	Hiljuti tekitas Meie Paldiski Facebooki grupis elevust ja rohkelt positiivseid reaktsioone ühe hea südamega noore mehe tegu. Erki Ott nägi kohaliku Coopi poe ees väikest segaduses olevat koera ringi jooksmas ja püüdis Facebookis koera peremeest leida. Koera koju aitamine ei piirdunud ainult sotsiaalmeedias tehtud postitusega. Erki Otti poolt 17. novembri õhtul Meie Paldsiski Facebooki grupis tehtud postitusele järgnesid kohalike kommentaarid, kes andsid teada, et koerakest oldi poe ees juba hommikul nähtud. Soovitusi jagati ka koera kiibi abil tuvastamiseks, mida saavat teha vallamajas. Kommenteeriti, et koerakest on varemgi poe juures jooksmas nähtud. Noor mees ei piirdunud koera aitamisel ainult Facebooki teavitusega, vaid pesi kodus koera ka puhtaks. Erki Ott rääkis Elu24-le, et koju jõudes andis mees koerale juua ja pakkus talle ka süüa ning toidukausi ette saanud loomake sõi isukalt järgmised kümme minutit. «Läksin kohalikku kaubamajja ja ostsin kõik koerale vajamineva, alustades toidust, lõpetades küünekääridest,» ütles Otti. Hiljem läks Otti koeraga jalutama ja jalutusrihma nägemine muutis neljajalgse tegelase üliõnnelikuks. Otti poolt kohalikku Facebooki gruppi tehtud postitusele reageeris koera peremees kiirelt ja nii pääses väike rändama läinud tegelane taas koju. 	Elu24	Elu24.ee	0	1
22. november 2019, 13:22	https://virumaateataja.postimees.ee/6832627/karud-panevad-kuusmaa-kae-all-proovile-uued-valismangijad	Postimees	Karud panevad Kuusmaa käe all proovile uued välismängijad	De Vante Rashawn Young (vasakul) ja Austin Dwight Wrighten soovivad Kadrina Karud Eesti esiliiga korvpalli meistrivõistlustel ree peale aidata. FOTO: Kadrina Karud Kadrina Karude korvpallimeeskonna rivistus täienes lisaks uuele peatreenerile Aivar Kuusmaale äsja paari palluri võrra. Mõlemad sellel nädalal Karude koosseisus registreeritud mängumehed saabusid Ameerika ühendriikidest ja on koos uute võistkonnakaaslastega harjutanud nüüdseks paar nädalat. 22-aastane ja 195 sentimeetrit pikk viskav ääremängija Austin Dwight Wrighten ja 21-aastane mängujuht De Vante Rashawn Young tulevad kadrinlaste eest platsile täna õhtul, kui Karud mängivad kodusaalis KK Viimsi/Noto tiimiga. 	Virumaa Teataja	Margus Martin	0	55
22. november 2019, 13:18	https://majandus24.postimees.ee/6832603/eesti-energia-vallandas-usalduse-kaotanud-tutarfirma-juhi	Postimees	Eesti Energia vallandas usalduse kaotanud tütarfirma juhi Sutter: me ei tolereeri küsitavat käitumist	Enefit SIA juht Janis Bethers. FOTO: Zane Bitere/LETA Eesti Energia vallandas Läti tütarfirma Enefit SIA juhi Janis Bethersi. Ametist vabastamise põhjuseks on usalduse kaotamine, mille on tinginud Eesti Energia sisekorraeeskirja rikkumine. Enefit SIA ainuaktsionäri, Eesti Energia juhatuse esimehe Hando Sutteri sõnul on edasine koostöö Janis Bethersiga välistatud. «Enefit on Lätis tuntud ja klientide poolt kõrgelt usaldatud energialahenduste pakkuja. Et väljateenitud usaldust hoida, peab ka meil endil olema laitmatu juhtimiskvaliteet. Me ei tolereeri küsitavat käitumist ja oleme seetõttu otsustanud töösuhte Janis Bethersiga lõpetada,» ütles Sutter. Enefit SIA juhatuses jätkavad Krists Mertens ja Klavs Porikis ning juhatusega liitub Eesti Energia müügi- ja kliendioperatsioonide valdkonna juht Indrek Randveer. Juhatuse esimehe kohuseid hakkab täitma Krists Mertens kuni uue juhi leidmiseni. Rohkem infot toimunu kohta hetkel pole Eesti Energia teatel võimalik anda, kuna täpsemad asjaolud on konfidentsiaalsed. «Enefiti omanikul Eesti Energial ja minul olid äriarendusest ja ettevõtte juhtimisest väga erinevad arusaamad ja me ei suutnud koostöö jätkamises leppeni jõuda,» ütles Bethers BNSile. Ta juhtis ettevõtet 11 aastat ning on uhke selle üle, et Enefit kasvas selle ajaga üheks Läti juhtivaks energiamüüjaks. Enefit SIA käive kasvas möödunud aastal 28,6 protsenti, 59,6 miljoni euroni, kuid langes tunamullusest miljoni eurosest kasumist 2,4 miljoni euroga kahjumisse. 	Majandus	BNS, Janno Riispapp	0	9
22. november 2019, 13:14	https://lemmik.postimees.ee/6832583/jahmatavad-kaadrid-eestlanna-jootis-sulekoerale-alkoholi-ja-jagas-videot-sotsiaalmeedias	Postimees	Jahmatavad kaadrid: eestlanna jootis sülekoerale alkoholi ja jagas videot sotsiaalmeedias	Foto on illustratiivne. FOTO: Shutterstock Sotsiaalmeedias ringleb video, millest on näha, nagu pakuks filmija väikesele koerale alkoholi. Kogu vahejuhtumit saadavad eestikeelsed kommentaarid ning rõkkav naer, kui koerake mööda tuba uimerdab.   Esmalt jagas häirivaid kaadreid MTÜ Loomapäästegrupp juhatuse liige Heiki Valner, kelle hinnangul ei tohiks looma selline seisund ühtegi südamega inimest naerma ajada. Sõna võtsid ka Eesti Loomakaitse Seltsi (ELS) liikmed. Nad uurisid politseilt, kas sellise video põhjal on võimalik menetlust algatada. Vastuseks saadi, et üksnes video ei tõesta nagu oleks koerale joodetud alkoholi ja see tema tervist kahjustas. Loomakaitsjad meenutasid neile, kes pole ise selle peale tulnud, et alkohol on koertele mürk. Sülekoerad võivad juba väikese alkoholikoguse manustamise järel surra. «Loomad usaldavad meid ja usuvad, et me hoolime neist - seda ei tohiks kurjasti ära kasutada,» toonitasid nad. 	Lemmik	lemmik.postimees.ee	1	559
22. november 2019, 13:09	https://kultuur.postimees.ee/6832591/lavaka-tudengid-jagavad-lava-aleksander-eelmaa-ja-ita-everiga	Postimees	Lavaka tudengid jagavad lava Aleksander Eelmaa ja Ita Everiga	Hetk Eesti Draamateatri lavastusest „Päikese lapsed“, mille lavastaja Uku Uusberg toob välja EMTA lavakunstikooli 29. lennu tudengitega. FOTO: Laura Pählapuu Laupäeval, 23. novembril esietendub Eesti Draamateatri suures saalis Maksim Gorki „Päikese lapsed“, mille lavastaja Uku Uusberg toob välja EMTA lavakunstikooli 29. lennu tudengite ning Aleksander Eelmaa ja Ita Everiga. Maksim Gorki kirjutas „Päikese lapsed” 36-aastaselt ajalooliselt murrangulisel 1905. aastal ning tähelepanuväärne on fakt, et see näidend on kirja pandud vangis istudes. Gorki osales 1905. aasta alguses riikliku võimu suhtes kriitilisel meeleavaldusel, milles nõuti kehtiva riigikorra vägivallatut muutumist, mille tagajärjel ta vägivaldselt arreteeriti. Näidendi peategelasteks on vene intelligendid, kes üritavad keset ühiskondlikku lõhestumist seista aadete ja suuremate väärtuste eest äsja alanud 20. sajandil – teha teadust, viljeleda kunsti, armastada. 19. sajandi keskpaigaks oli eliit (ka Venemaal) aru saanud, et hierarhia pole humanistlikult jätkusuutlik, suurriikides kaotati küll pärisorjus, kuid 20. sajandi alguseks kobrutas maailmas endiselt ülekohus ning süvenes ühiskondlik lõhe. Mis siis 19. sajandil muutmata jäi? Kas me suudame täna seda kuidagi mõista? Millest inimkond loobus? Küsimused püsivad tänaseni. Maksim Gorki, „Päikese lapsed“. Lavastaja Uku Uusberg. Kunstnik Laura Pählapuu. Valguskunstnik Priidu Adlas. Helikujundaja Hendrik Kaljujärv. Tõlkinud Hans Luik. Osades EMTA lavakunstikooli 29. lennu tudengid Jan Erik Ehrenberg, Ekke Märten Hekles, Simo Andre Kadastu, Martin Kork, Lena Barbara Luhse, Maris Lüüs, Märten Metsaviir, Maarja Johanna Mägi, Kaarel Pogga, Oskar Punga, Kristiin Räägel, Ken Rüütel, Oskar Seeman, Andreas Aadel, Markus Helmut Ilves, Mihkel Kohava ning Ita Ever ja Aleksander Eelmaa Eesti Draamateatrist. 	Kultuur	Kultuuritoimetus	0	2
22. november 2019, 13:05	https://maailm.postimees.ee/6832586/venemaa-teatel-vois-louna-hiina-meres-toimuda-kiirgusintsident	Postimees	Venemaa teatel võis Lõuna-Hiina meres toimuda «kiirgusintsident»	FOTO: Yui Mok / PA Images / Scanpix Venemaa tarbijakaitseamet Rospotrebnadzor asus laiendama kiirgusseiret Kaug-Idas, sest Lõuna-Hiina merest lähtuv kiirgustase asus «kiirgusintsidendi» järel tõusma. «Globaalsest keskkonnaseire süsteemist (GEMS) tuleva info järgi asus kiirgustase Lõuna-Hiina meres tõusma kiirgusintsidendi tõttu. Rospotrebnadzor asus suurendama kiirgusseiret lähedalasuvatel piirialadel,» ütles ametkond täna. «Venemaa elanikkonnale negatiivse mõju ohtu ei ole,» lisas ta. Ametkond ei täpsustanud, mis meres juhtus. GEMS-i andmete järgi tõuseb kiirgustase Hiinas asuva Zhanjiangi lähistel juba 21. novembrist ja on tasemel 0,22–0,24 mikrosiivertit tunnis. Zhanjiangis asub suur sadam, mida teatakse keemia-, toidu- ja masinaehitustööstuse poolest. USA raadiojaamades WBCQ ja KYAH edastatud raadiosaates Hal Turner Radio Show väideti, et merepinnast 50 meetri sügavusel kärgatas 10–20-kilotonnine plahvatus. Sõjaväeallikate sõnul polnud see maavärin. 	Maailm	Interfax / BNS	0	0
