23. november 2019, 14:14	https://tervis.postimees.ee/6833096/ravimi-korvaltoime-voib-valja-naha-nagu-uus-haigus	Postimees	Ravimi kõrvaltoime võib välja näha nagu uus haigus	Võib olla juhtumeid, kus ravimite koos kasutamisel üks ravim võib tugevdada või nõrgestada teist. FOTO: Markus Mainka/PantherMedia / Markus Mainka Aeg-ajalt tasuks perearstiga koos oma ravimid üle vaadata, eriti kui neid on palju, mida korraga võtta tuleb, ütles kardioloog ja Ravimiameti meditsiininõunik Alar Irs saates «Patsiendiminutid». Patsientide teadlikkus nende haigustest, ravist ja ravimitest on väga erinev. Viimasel ajal näeb Irs oma töös üha enam inimesi, kes soovivad ravist aru saada ja ravimitest rohkem teada. Kevadises ravimite kasutamise küsitluses uuris Faktum, kas inimesed muudavad ka ise oma raviskeemi ja üksteist protsenti vastanutest ütles, et mõnikord nad jätavad mõned arsti poolt määratud ravimid võtmata. Meeste puhul oli peamine põhjus, et ravimeid on korraga võtmiseks liiga palju ja naised jätsid kõige sagedamini ravimi võtmise pooleli mõne ebasoovitava kõrvaltoime ilmnemisel. Irsi sõnul on küll positiivne, kui patsiendid tahavad osaleda oma raviotsustes, aga seda on alati mõistlik teha koos arstiga. Tohter oskab selgitada, millised on võimalikud riskid, kui patsiendile tundub, et ravim talle ikkagi ei sobi. Arst aitab otsustada, kas ravimi võib ära jätta või saab selle asendada. Faktumi uuringu järgi on ravimite kallis hind üks põhjus, miks noored mehed jätavad ravimeid välja ostmata. Irsi sõnul on krooniliste haiguste ravimid ravikindlustatud patsientidele üsna soodsad, esineb ka üksikuid erandeid, kus haigekassa ravimi ostmist ei toeta. Sel juhul tasuks arstiga oma murest rääkida, tihti on võimalik valida ka teine ravim. Ravimite ebasoovitavaid toimeid võib olla vahel keeruline ära tunda, kuna need näevad välja tavalise haigusena, näiteks tõuseb vererõhk või tekib köha. Tuleb ka ette, kus ravimite koos kasutamisel üks ravim võib tugevdada või nõrgestada teist. Mõnikord aga avaldub ravimi kõrvaltoime siis, kui inimese endaga midagi muutub, näiteks jääb krooniliselt ravimeid kasutav inimene ägedalt haigeks. Eestis on arstidel tänu retseptikeskusele väga hea ülevaade, millised ravimid on välja kirjutatud ja millised inimene välja ostab. Ravimite sisse võtmine jääb siiski patsiendi ülesandeks. 	Tervis	Kadri Tammepuu	0	12
23. november 2019, 14:06	https://sobranna.postimees.ee/6832847/raheli-rasedusblogi-juhend-rasedatele-kuidas-sopradele-joomist-mangida-ja-mitte-vahele-jaada	Postimees	Raheli rasedusblogi: juhend rasedatele, kuidas sõpradele joomist mängida ja mitte vahele jääda	FOTO: Shutterstock Tegin eelmisel nädalal viis rasedustesti ja kõigil neil oli kaks joont. Kaks väga heledat, väga hädist joont. Dr Google kinnitab mulle, et ükskõik kui hele, teine joon on teine joon, aga kahtlus on ikkagi hinges. Otsustame mehega, et me ei räägi kindlasti sellest veel mitte kellelegi, sest mine tea, mis võib veel juhtuda. Esiteks võib sellel väga varasel rasedusel, kui ta on üldse rasedus, olla loendamatuid komplikatsioone. Kujutan juba ette, kuidas mind tabletiga puhastusele saadetakse, kui ultrahelis kinnitatakse, et täpil mu kõhus ei ole südamelööki või see asub hoopis väljaspool emakat või laseb ta ise lahti ja kaob lihtsalt ära. Lihtsalt lakkab eksisteerimast. Kuna ma olen väga kaua rasedaks jäämise peale mõelnud, olen ma väga palju igasuguseid blogisid ja artikleid lugenud. Kohe tuleb meelde Malluka mitme aasta tagune postitus, kus ta detailselt oma raseduse peetumisest kirjutas, ja klomp tõuseb kurku. Ei, ma kindlasti ei taha veel kellelegi peale mehe sellest rääkida. Isegi välismaa sõbranna, kes üldse esimese testi osta soovitas, jäta totaalsesse infosulgu ja igaks juhuks ei suhtle temaga enam üldse. Ta küsib mult mitu korda, mis viga, ja ma panen telefoni hääletuks. 	Sõbranna	Rahel S.	0	1
23. november 2019, 14:05	https://majandus24.postimees.ee/6833297/soome-fond-on-tallinnas-soetanud-pooltuhat-uurikorterit	Postimees	Soome fond on Tallinnas soetanud pooltuhat üürikorterit	Kuvatõmmis Soome fondi kodulehest. Asuntosalkku plaanis veel mõni aasta tagasi soetada Tallinnas tuhandeid kortereid, pooltuhat on olemas. FOTO: Astuntosalkku Põhjanaabrite investoritele kuuluv Asuntosalkku Eesti OY on lühikese ajaga soetanud Tallinnas pooltuhat üürikorterit, mida on kümme korda enam kui neli aastat tagasi. Soome üürivahenduse turuliidri Vuokraturva OYga samasse gruppi kuuluv Asuntosalkku (tõlkes elamu- või korteriportfell – toim) alustas Tallinnasse investeerimisega umbes viis aastat tagasi. 2015. aastal rääkis Vuokraturva OY suurim omanik ja juht Timo Metsola Kauppalehtile, et esimesed 50 korterit on Tallinnas täieliku saladuskatte all ostetud. «Ettevõttel on plaan lähiaastatel osta tuhandeid kortereid,» lisas ta. «Üks on selge, Eestis ei ole mingit mõtet piirduda paarisaja korteriga.» 	Majandus	Janno Riispapp	4	679
23. november 2019, 14:05	https://sport.postimees.ee/6833301/johaug-voitis-konkurente-kalendriga-meestest-oli-parim-tonseth	Postimees	Johaug võitis konkurente kalendriga, meestest oli parim Tönseth	Theresa Johaug FOTO: LISI NIESNER/REUTERS Norras Beitostölenis toimunud murdmaasuusatamise võistlusel võitis naiste 10 km eraldistardist klassikasõidu norralanna Therese Johaug. Meeste 15 km sõidus teenis esikoha kodupubliku ees võistelnud Didrik Tönseth. Naistesõidus oli Johaugi ülemvõim mäekõrgune: ta edestas koondisekaaslast Heidi Wengi minuti ja nelja sekundiga, kolmas oli 18-aastane Norra tulevikulootus Helene Marie Fossesholm minuti ja 18-sekundilise kaotusega. Johaug rääkis võistluse järgselt NRKle, et üle pika aja suusatamises võistelmine oli lõbus, kuid natuke võõras. 32-aastase norralanna sõnul ei tulnud tal esimene ring tehniliselt hästi välja, aga teine oli juba parem. Neljanda koha teenis ameeriklanna Jessica Diggins (+1.35). Viies oli samuti ameeriklanna Sadie Björnsen (+1.37) ja kuues norralanna Marte Skaanes (+1.52). Tagasihoidliku sõidu tegid kaks nimekat Norra A-koondislast. 2007. aasta sprindi maailmameister Astrid Uhrenholdt Jacobsen lõpetas 11. kohal (+2.21), Pyeongchangi olümpial 15 km vabatehnikasõidu võitnud Ragnhild Haga finišeeris alles 15. ajaga (+2.31). Meeste distanstil võidutses eelmise hooaja MK-sarja viies mees Didrik Tönseth. Norralane läbis 15 km ajaga 34.56,7, edestades teisena lõpetanud kaasmaalast Johannes Hösflot Kläbot 18,9 sekundiga. Poodiumi madalaimale astemel tõusis norralane Simen Hegstad Krüger, kes kaotas võitjale 36,5 sekundiga. Esikuuikusse mahtusid veel kolm norralast: Emil Iversen (+40,9), Paal Golberg (+41,2) ja Martin Löwström Nyenget (+43,8). Tänavusel aastal Seefeldi MMil sel distantsil maailmameistriks kroonitud Martin Johnsrud Sundby näitas täna alles 31. aega, kaotades võitjale 2 minuti ja 27,8 sekundiga. Beitostölenis võistlesid peamiselt ainult Norra ja USA parimad suusatajad. Teistest riikidest olid stardis vaid üksikud esindajad. Murdmaasuusatamise MK-sari algab tuleval reedel Rukal, kui hooaega alustatakse sprindivõistlusega. 	Sport	Carl-Robert Puhm	1	19
23. november 2019, 13:40	https://maailm.postimees.ee/6833292/baron-cohen-hitler-oleks-saanud-facebookis-juudivastast-reklaami-teha	Postimees	Baron Cohen: Hitler oleks saanud Facebookis juudivastast reklaami teha	Sacha Baron Cohen. FOTO: ADM/Capital Pictures/Scanpix Kui Facebook oleks eksisteerinud 1930. aastatel, oleks Adolf Hitler saanud seal juudivastaseid reklaame postitada, ütles Briti koomik Sacha Baron Cohen neljapäeval. Ali G, Borati ja Brüno tegelaskujude looja tõi neljapäeval New Yorgis Laimuvastase Liiga (ADL) konverentsil sotsiaalmeediafirmade vaenu ja vägivalda võimendavast toimest rääkides välja just USA tehnoloogiahiiu Facebooki, mis lubab poliitilisi reklaame faktikontrollita avaldada. «Kui Facebook oleks olnud olemas 1930. aastatel, oleks ta lubanud Hitleril postitada 30-sekundilisi reklaame »juudi probleemi lahendusest«,» ütles Baron Cohen ADL-i auhinda vastu võttes. Facebook ütles AFP-le, et näitleja on nende poliitikast valesti aru saanud. «Vaenukõne on tegelikult meie platvormil keelatud. Me paneme keelu inimestele, kes propageerivad vägivalda ning kõrvaldame kõik, kes seda ülistavad või toetavad,» ütles firma pressiesindaja. «Mitte keegi - ka mitte poliitikud - ei saa Facebookis vihkamist, vägivada ega massimõrvu propageerida ega reklaamida.» 	Maailm	AFP / BNS	1	0
23. november 2019, 13:30	https://sport.postimees.ee/6833290/karmid-trahvid-kehtestanud-inglismaa-legend-ma-pole-diktaator	Postimees	Karmid trahvid kehtestanud Inglismaa legend: ma pole diktaator Lisatud karistuste nimekiri	Frank Lampard (paremal) ja tema hoolealune Tammy Abraham. FOTO: Paul Terry/Sportimage/PA Images Hiljaaegu lekkis meediasse infokild, mille kohaselt selgub, et Londoni Chelsea peatreener Frank Lampard kehtestas enda hoolealustele range trahvireeglistiku, mille vastu eksimine läheb superstaaridele kalliks maksma. Näiteks võib trahvide nimekirjast leida punkti, kus igale meeskondlikule koosolekule hilinetud minut maksab 500 naela (582 eurot). Treeningule hiljem jõudmise korral peavad Chelsea mängijad kergendama enda rahakukrut 20 000 naela võrra (23 297 eurot). «Esmapilgul tundub see karm, kuid seda on võimalik vältida kui sa ei hiline. Lihtne,» sõnas endine Inglismaa koondislane, kes vestles enne trahvide kinnitamist ka jalgpalluritega. «Ma ei taha endale mingit rõhuja tiitlit saada, sest ma pole. Poisid (mängijad) olid protsessi käivitamise juures. Ma pole trahvide maias diktaator.» Chelsea mängumeeste eksimustest teenitud tulu läheb tervenisti heategevuseks. «Me ei räägi väikesest hilinemisest, sest nii mõnelgi juhul tulevad mängijad tund aega hiljem ja see on vastuvõetamatu. Eriti mängib see rolli olukorras, kus valmistume matšiks Manchester City vastu.» Londoni suurklubi paikneb Premier League'i liigatabelis kolmandal kohal, olles 12. vooruga kogunud 26 punkti. Tänane vastane City asub neist ühe koha võrra madalamal, tiitlikaitsjate hooaeg pole oodatud kujul algand ning seni on neil kirjas 25 silma. Chelsea's fine list had everyone talking yesterday! 💰 Have you ever faced a similar (cheaper) fate? Whether it's your local sports team, in the office, at university or anywhere else, we want to hear your funniest fines stories! Let us know 👇 pic.twitter.com/03MDwzTJIp 	Sport	Postimees Sport	0	8
23. november 2019, 13:28	https://tartu.postimees.ee/6833222/arendusmaratoni-voitis-pilliroost-joogikorsi-tootev-ettevote	Postimees	Arendusmaratoni võitis pilliroost joogikõrsi tootev ettevõte	Arendusmaratoni võitja Suckõrs meeskond. FOTO: Tallinna Teaduspark Tehnopol. 20.–22. novembrini korraldas Tehnopol koos EASi ja Tartu Teaduspargiga Tark Tööstus arendusmaratoni, mille käigus töötati välja 8 lahendust Eesti tööstusettevõtete digitaliseerimiseks ja protsesside tõhustamiseks. Arendusmaratoni võitis Suckõrs, mis toodab pilliroost korduskasutatavaid joogikõrsi. «Tööstussektoris on digitaliseerimine ja innovatsioon lahutamatud osad, mis aitavad ettevõtetel liikuda väärtusahelas. Targa Tööstuse arendusmaratonid on näidanud, et Eesti tööstusettevõtete ja IT-ettevõtete vahel on kokkupuutepunkti loomine olulisel kohal. Arendusmaratonidel loodavad koostööprojektid tõsta nii tööstusettevõtetes kui ka IT-ettevõtetes kompetentsi, et sünniks üha rohkem tööstusettevõtete arenguks vajalikke digitaalseid ja innovaatilisi lahendusi,» ütles EASi tööstuse digitaliseerimise projektijuht Kersti Kuusksalu. «Eestis on palju just väikeseid või keskmise suurusega tööstusettevõtteid, millel oleks kvaliteedi mõistes võimekus toota suure ekspordipotentsiaaliga tooteid, kuid ressurssidest jääb puudu. Arendusmaratoni võitnud Suckõrs on hea näide, kuidas ka tagasihoidlikest tootmistingimustest alustanud idufirma saab edeneda tööstussektorisse, arendada välja innovaatilise tööstusprotsessi ning saavutada digitaalsete lahenduste abil ekspordipotentsiaaliga tootmisvõimsus,» ütles Teaduspargi Tehnopol innovatsioonijuht Kadi Villers. Suckõrs – automaatne süsteem pilliroo lõikamisel, mis pilliroo ettekandel jätkukoha fototuvastuse abil registreerib ning annab saele informatsiooni selle eemaldamiseks. Enics Eesti – automaatlõikamise süsteem elektrolüütkondensaatoritele. Puidukoda/ Proladu – lahendus võimaldab ladustuspindade visualiseerimisega lihtsustada laost kaupade leidmist. Puidukoda/ Singleton – ERP-süsteemiga ühilduv laopinna haldussüsteem, mis võimaldab varude tarka paigutamist suurtel laopindadel. Puidukoda – ERP-süsteemiga liidestatud laopinna haldamise süsteem, mis võimaldab positsioneerida tooteid ja optimeerida laoprotsesse. Digiarhitekt – lahendus võimaldab tööstusettevõttel tuvastada õige lahendamist vajav probleem ja leida sellele optimaalne lahendus ning selle pakkujad. Doordec ladu – lahendus võimaldab reaalajas toodete jälgimist laos ja automaatset registreerimist territooriumilt välja liikumisel. Doordec klient – toote elutsükli jälgimise platvorm NFC ja QR-koodi baasil. Afterone – lahendus võimaldab andmekogumise automatiseerimist toote 3D-mudeli põhjal hinnapäringute ja -pakkumiste tegemise kiirendamiseks. Varasematel Targa Tööstuse üritustel on oma väljakutsele digilahendusi otsinud ja leidnud mitmed edukad ettevõtted, nagu PipeLife Eesti, BHC, Incap Electronics, Elektrilevi, Operail, Palmse Mehaanikakoda, Räpina Paberivabrik ja paljud teised. Lisaks on arendusmaratonidel valideeritud või edasi arendatud ka juba töös olevaid muudatusi, nagu on teinud Ericsson Estonia või Enics Eesti. 	Tartu Postimees	Tartu Postimees	1	0
23. november 2019, 13:00	https://tarbija24.postimees.ee/6832451/ettevotted-vahendavad-hoogsalt-suurhoonete-rohmakat-okoloogilist-jalajalge	Postimees	Ettevõtted vähendavad hoogsalt suurhoonete rohmakat ökoloogilist jalajälge	04.11.2019. Tallinn. Delta Plaza. FOTO: Eero Vabamägi Energiateenus OÜ asutajate Aivar Uutari ja Siim Meeliste sõnul pööravad Eesti ettevõtted aina enam tähelepanu energiatõhususele, kuid seda on endiselt liialt vähe ning keskendutakse ainult uutele energiatootmislahendustele. «Kui võtta üheksa artiklit kümnest, mis ajakirjanduses on, siis enamasti nad räägivad sellest, et meil on vaja taastuvaid energiaallikaid, mitte ei räägita sellest, et äkki me tarbime üldse liiga palju. Minu väide on see, et kui me täna tarbime kümme ühikut ja meil õnnestub leida häid lahendusi, et viia see tarbimine kümnelt kuue peale, siis on meil ülehomme vaja rajada nelja ühiku võrra vähem tootmisvõimsust, mis tähendab ka väiksemat investeeringut tootmisesse,» selgitas Uutar, kuidas rohelisema tootmise asemel võiks rääkida ka keskkonnasäästlikumast tarbimisest. Kokkuhoid viis miljonit Energiateenus OÜ abi on kasutanud juba omajagu teada-tuntud nimesid Eesti areenil: Rimi, Coopi keskühistud, Tartu linn läbi nende hallatava Aura veekeskuse, kinnisvarafondidest näiteks East Capital, kinnisvaraettevõtetest Kapitel (endine E.L.L. Kinnisvara), kinnisvarahaldajana BPT Real Estate, ning ettevõtte väitel on nad aidanud oma klientidel kokku hoida üle viie miljoni euro viimase viie aasta vältel. Energiateenus analüüsib oma klientide hoonete energiakasutuse tõhusust ning peale analüüsitulemuste avaldamist pakuvad välja meetmed, mida sisse viia hoone energiakasutustõhususe parandamiseks. Peale meedete sisseviimist tegeleb ettevõte ka seirega, et tagada uuenduste korrektne töötamine. «Kunde peab meie lahendustest saama sellise kasu, mis parandab tema finantsilist olukorda. Müügiasutuse puhul näiteks aitab see klientidel paremini tooteid näha ja ehk tänu sellele ka rohkem oste teha, kuna hoone sisekliima (hea soojus, hea valgustus) kutsuvad teda tagasi,» selgitas Uutar, rõhutades aga ka, et tema ettevõtte meetmetega teenitakse uuendustesse investeeritud raha tagasi ajapikku, mitte kohe. Seoses põlevkivienergia konkurentsivõime vähenemisega turul ennustab Uutar, et Eesti elektritootmine, mis on selle aasta vältel juba korralikult vähenenud, langeb veelgi (paari aasta eest toodeti kohalikult vähemalt 125 protsenti Eestis vajaminevast elektrienergiast, selle aasta septembris aga näiteks ainult 72 protsenti). Lahendus sellele: kasutada vähem elektrienergiat, mis on igati võimalik. «Kui me seda tendentsi või trendi oskame ette aimata, siis miks mitte end ette valmistada ja viia oma kilovatt-tunnid piltlikult sajalt kuuekümnele, eriti kui on näha, et sellega koos laheneb mingi probleem veel ära,» selgitas Uutar hoonete energiatõhususse investeerimise mõtet. Pildil Aivar Uutar, taustaks Aura Veekeskus. FOTO: Kristjan Teedema Millest aga on jutt, kui me räägime hoonete energiatõhusamaks tegemisest? Energiateenus hindab konkreetsete majade energiakasutuse tõhusust olenevalt nende otstarbest (hotellid, koolid, kaubanduskeskused, büroohooned, veekeskused jne), ja pakub võimalusi, kuidas maja igapäevatöös vajamineva energia kogust vähendada nii, et asutuse funktsionaalsus ei langeks. Seda näiliselt lihtsate meetmetega, mille peale Uutari ütlust mööda kinnisvarahaldurid ise ei mõtle. «Võtame näiteks elektri kasutuse koolimajas. Elekter kulub valgustusele, vihmaveerennide kütteks, kliimaseadmetele, arvutitele, turvasüsteemidele, köögiseadmetele, pumpadele jpm. Tuleb hinnata, et kas need süsteemid, kuhu energiat kulub, töötavad adekvaatselt. Kuni selleni välja näiteks, et kui koolimajas on tunnid kella kaheksast neljani, siis kas on põhjendatud, et kogu koolimajas tuled peale kella nelja põlevad? Kõlab triviaalselt, aga näide reaalsest elust,» selgitas Uutar. Samuti on tema sõnul näiteks küllaltki raske põhjendada, miks peaks koolimaja seinal tänavavalgustuslamp põlema ööd ja päevad, sõltumata kas on koolivaheaeg, koolipäev või puhkepäev. «Kunagi on nad niimoodi tööle pandud ja tihti kohalik juhatus isegi ei märka, et see on probleem, sest see on nende jaoks tapeediks muutunud,» rääkis Uutar. Ta lisas, et meetmed, mida nad hoonete puhul rakendavad, nõuavad detailiderohket eeltööd, millega hoonete omanikud tihti ei viitsi tegeleda. Kokkuhoid igal sammul «Võtame näiteks kaubandushoone, millega tegelesime,» kirjeldas Uutar üht projekti. «Me võtsime elektrikilbi ruumidelt jääksoojuse, mis visati muidu kõik õue, ning suunasime autoparkla kütteks. Kõlab loogiliselt, aga lihtne oli otse õue lükata. Samuti õpetasime kaubanduskeskuse juhtkonnale, et uksi ei tohiks vastastikku panna, kuna sealt läheb soe välja. Selle peale öeldi, et see on klientide jaoks ebamugav ja uksed peavad otse ja vastastikku olema. Hästi, aga kui on otse, siis pange püstipidi õhkkardinad, mis takistavad sooja väljaimbumist,» rääkis Uutar. Ta tõi ka näite, et külmasüsteemid toodavad külma, aga selle tootmise käigus tekib samal ajal ka sooja. See soe, veel aasta aega tagasi, läks 95 protsenti taevasse. «Tänasel päeval on aina enam hakatud neid süsteeme ringi ehitama, ka seal tegime me nii, et suunasime külmasüsteemide jääksoojuse hoone kütteks (automaatikasüsteem sai võtta seda jääksooja maja sektsioonide kütteks, mis seda parasjagu vajasid). See soojus on siis kaubanduskeskusel ilma rahata käes, tänu millele ta peab ostma vähem kaugkütet,» tõi Uutar näiteid meetmetest, mida nad soovitavad ettevõtetel ja kinnisvaraomanikel kasutada. Rebase Rimi Tartus muutis kogu maja küttesüsteemi, et kasutada energiat tõhusamalt. FOTO: Sille Annuk Miks selliseid lahendusi kohe ei tehta? Sest nende peale ei mõelda ja nad maksavad raha. «Ehitushangete ja ehitusprotsessi juures on investeerimismaksumus tihti fikseeritud. Seepärast tehakse kiirustades otsuseid, mis ei arvesta hilisemaid kasutuskulusid ja kasutusmugavust,» selgitas Uutar, kuidas tehakse võimalikult väikseid investeeringuid eesmärgiga raha võimalikult kiiresti tagasi teenida. Meeliste lisas, et investeeringu tegemisel jätavad paljud investorid analüüsimata, et hoone on pikemaks ajaks käes kui viis aastat, ja et kui teha alguses kallim investeering, on tulemus kogu hoone või tehnosüsteemi kasutuse ajal parem. Uutar rõõmustas aga, et üldine teadlikkus energiatõhususe maksimeerimise vajalikkusest jupikaupa paraneb, eriti, kuna vanematel majadel on vaja uutega võistlemisel mingit eelist. Selleks saab olla näiteks keskkonnasertifikaat, mis võtab arvesse erinevaid aspekte hoone juures: parkimiskohtade arv, jalgrattaparkla olemasolu, energialahendused, puhkenurgad jpm, ja mille saamisel kasvatab kinnisvaraomanik kinnisvara väärtust. Selle saamiseks peab aga hoone olema muuhulgas energiatõhus. Valed kulud Veel selgitas Uutar, et nende koostöö klientidega saab tihti alguse muudel alustel, kui seda on energia säästmine. «Konkreetse näitena võib tuua ühe hulgiladudega opereeriva ettevõtte, kes pöördus meie poole paar aastat tagasi kaebusega, et müügisaalides on liiga pime,» kirjeldas Uutar. «Kohapeal avastasime, et nende valgustid olid liiga kõrgel ja valgustite spekter oli vale - valgustati riiulipealseid ja põrandat, mitte kaupa. Lisaks olid nende valgustid ligi 20 aastat vanad,» jätkas Uutar. Tema sõnul tegid nad ettepaneku, et viivad nende valgustustihedustaseme paremaks, samal ajal parandades üldist valgustustaset ja vahetades valgustid. Selle kõige juures nende kulud langeksid, kuigi teenus muidugi maksab mingi summa. «Klient proovis meie teenust ühe poe puhul, pärast seda otsustati meie pakutud lahendusi kõikides selle ettevõtte poodides kasutada. Ning selle kaudu levib info meie tegevusest edasi, eks me ise käime ka aegajalt klientide juures ja astume üles oma pakkumistega,» selgitas Uutar oma ettevõtte klientide kasvu. Meeliste manitses lõpetuseks, et ei piisa sellest, kui me uute asjade puhul keskendume kliimasõbralikkusele, vaid me peame tagasiulatuvalt tegelema ka selle energiaga, mis juba käigus on, selle süsinikumahukust vähendama, et saavutada see efekt, mida kliimamuutuste peatamiseks saada soovime. «Energiatõhususe ja hoonete sisekliima vallas on üüratu tööpõld ja üüratu potentsiaal. Lollust ja raiskamist on ebamugavalt palju,» võttis Uutar teema kokku. Positiivseid samme on juba astutud, ent terve maraton on veel joosta. BPT Real Estate tegevjuht Janek Hintsov: Üha rohkem mõeldakse kõrvalkuludele Kui ehitatakse maja, siis kaks aastat on maja arhitekti käes, kaks ehitaja käes ja viiskümmend aastat haldusettevõtte käes, kelle valikud on üliolulised. Tänapäeva majad, mis ehitatakse, on täis erinevaid tehnilisi lahendusi: ventilatsioonisüsteemid, jahutussüsteemid, turvasüsteemid, videovalve, läbipääsud, mis kõik vajavad inseneri lähenemist. Sageli on nii, et kui sa võtad endale uue pinna, siis kaubeldakse üürihinna üle. Üha rohkem ja rohkem aga on hakatud mõtlema ka kõrvalkulude peale, mis hakkavad olema maja valmimisel. Sellel hetkel on kinnisvaraomanikul vaja haldusettevõtet, kes läbi oma kogemuste annab soovitusi, kuidas erinevaid tehnosüsteemi lahendusi, turvasüsteemide lahendusi jne teha. Üürnikud on väga teadlikud endale büroopindade ja kaubandusruumide valimisel. Et eristuda, siis peavad omanikud panustama väga palju energiatõhususse. Rimi kinnisvarajuht Urmas Sildnik: investeering peab viie aastaga ära tasuma Koostöö Energiateenus Grupiga sai alguse aastal 2014. Esiteks aitasid nad meil automatiseerida ventilatsiooni ja soojussõlmesid, muuta need kaugloetavateks. Teiseks, kuna me kasutame oma kauplustes palju CO₂-l põhinevaid külmaseadmeid, siis nad aitasid meil külmaseadmete jääksoojust rakendada hoonete kütmiseks ja tarbevee soojendamiseks. Meil on Tartus näiteks Rebase Rimi, kus nad mõtlesid kompleksselt välja kogu selle maja küttesüsteemi, ehitades igale poole ventilaatoreid, et saada soojust paremini põranda tasandile. Energiateenused on toonud meile kõige rohkem kasu läbi automatiseerimise ja säästlike energialahenduste väljatöötamise. Nad on aidanud meil kindlasti säästa. Meie majasisene reegel on, et investeering peab viie aastaga ära tasuma, ning umbes selle ajaga ongi meie investeeringud energiatõhususse end tasa teinud. Kapiteli kinnisvarajuht Vahur Kaska: otsuse dikteerivad lõppkulud Suhtumine energiatõhusatesse lahendustesse sõltub kliendist ja tema eelistustest. On kliente, kelle jaoks on oluline võimalikult madal üüritase ja kõrvalkuludele, sh energiakuludele ei pöörata erilist tähelepanu. Kliendid ei ole üldjuhul siiski huvitatud niivõrd energiasäästlikest lahendustest, vaid madalatest lõppkuludest. Meie kogemuste kohaselt on energiatõhusate ja «roheliste» lahenduste teemal üldjuhul teadlikumad rahvusvaheliste (suur)firmade kohalikud tütarettevõtted ja filiaalid, kus selline suhtumine on omaks võetud kontserni tasemel. Peame oma bilansis olevaid büroomaju oma aja ja klassi kohta (valmimisaeg 2007.-2008. a) päris energiasäästlikeks, kuid arvestades uute, nüüdisaegsetele nõuetele vastavate arenduste turuletulekuga peame pidevalt mõtlema ka oma objektide energiatõhususe suurendamisele. 	Tarbija	Magnus Altküla	0	0
