22. november 2019, 21:36	https://www.postimees.ee/6833077/alustame-puhtalt-lehelt-haabneeme-kooli-hoolekogu-esimees-selgitab-konflikti-vallaga	Postimees	«Alustame puhtalt lehelt»: Haabneeme kooli hoolekogu esimees selgitab konflikti vallaga	Haabneeme kooli hoolekogu esimees Antoon van Rems. FOTO: Sander Ilvest Täna andis Viimsi vallavanemale üle oma tagasiastumispalve abivallavanem Georg Aher. Haabneeme kooli hoolekogu esimehe sõnul on oluliselt lihtsam alustada puhtalt lehelt vallaga, kui abivallavanema kohal on uus inimene. Haabneeme kooli hoolekogu esimees Antoon van Rens ütles, et otseselt polnud Viimsi vallavalitsusega kokkulepet, et abivallavanem Georg Aher, kelle haldusalasse kuulub kool, peaks ametist taanduma. «Me (koolipere ja vallavalitsus- toim.) leppisime kokku, et alustame puhtalt lehelt ning kõik osapooled annavad endast parima, et taastada häid suhteid ja usaldust,» lausus van Rens. Viimsi vallavalitsus ütles teisipäeval erakorraliselt üles Haabneeme kooli juhi Sirje Toomla töölepingu, põhjendades seda koolis aset leidnud süsteemsete väärkohtlemise juhtumitega. Kogu Haabneeme koolipere leidis toona, et see on valla kius, kuna direktor leidis lahenduse väärkohtlemise juhtumile. Kolmapäeval said vald ja koolipere kokku ning neljapäeval taastas vallavanem Laine Randjärv töölepingu direktor Sirje Toomlaga. «Vald on Sirje Toomla suhtes käitunud ebaõiglaselt ja eriti veel kiirustades,» ütles van Rens ja lisas, et kooli poolt saadetud dokumendid, milles olid vallandatud vägivaldse õpetaja kohta faktid lisatud, oli vald teisiti mõistnud. Van Rens ütles, et vald oleks toona võinud koolil täpsustusi küsida. Sellest tekkis ka arusaamatus. «Kui arusaamatus on tekkinud, siis tuleks koos maha istuda ja arutada. Parandame oma vead ära ning liigume edasi,» selgitas ta. «Järgmisel päeval näeme aga raadios või lehes midagi muud.» Haabneeme koolis õpib üle 660 õpilase, kuid kool on ehitatud 504 õpilasele, siis direktor ja koolipere on soovinud vallalt saada lisa ruume ning vallaga hakati teemat arutama. «Kogu suhtlus läks ka läbi Georg Aheri ja sealt ei tulnud meile mingit vastust,» lausus hoolekogu esimees. Ühel hetkel hakkas kool ise lahendusi otsima, mida oli kaks: vana raamatukogumaja ja klassimoodulid. Valla pakutud Viimsi muusikakool ei sobinud, kuna see asub koolimajast endast liiga kaugel ja toitlustust on keeruline sinna viia või, et lapsed peaksid pika maa maha kõndima, et siis lõunat saada. Raamatukogus said nad ruume vaadata, sellega aitas neid hoopis teine abivallavanem, kuid sealses konstruktsioonis on viga sees. «Kuna meile ei tulnud aktiivset vastukaja, siis viimase valiku puhul võtsime ise pakkumised,» selgitas van Rens klassimoodulite ettepanekut vallale. Koos pakkumistega saatsid nad klassimoodulite võimaluse valda. Küsimusele, kas nii läks kiiremini, vastas hoolekogu esimees, et ei läinud. Inimesed tõstsid valla ignorantsuse pärast sotsiaalmeedias kisa. «Ütleme nii, et toimunud koosolekud on suuresti saanud meie initsiatiivil,» selgitas van Rens. Laine Randjärv pakkus pärast sotsiaalmeedia kisa välja kuupäeva, millal nad siis ka kohtusid. Antoon van Rens selgitas, et vald pakkus siis välja ruumipuuduse lahenduseks välja muusikakooli, koolipere selgitas vallavanemale, miks see ei sobi. «Siis ta heitis meile ette, et miks me ei ole tegelenud valla ettepanekuga,» ütles van Rens ja lisas, et Randjärv väitis ka koosolekul, et vald on pakkunud kolme varianti, milleks olid muusikakool, raamatukogu ja Kaluri tee 5 maja. Kohe pärast öeldut parandas Randjärv, et raamatukogu variant ei sobi. «Haridusameti juhataja ütles, et Kaluri tee 5 varianti pole kunagi edasi saadetud,» rääkis hoolekogu esimees Nüüdseks on küll volikogu moodulite variandi heaks kiitnud, siis see saab valmis heal juhul kevadeks, ent võimalik, et veereb järgmise aasta sügisesse. Kuigi Viimsi vallavanem Laine Randjärv on selgitanud viimastel päevadel, et Haabneeme kooli juhi töölepingu ülesütlemine ja kooli ruumipuudus pole omavahel seotud, siis van Rensi sõnul ei oma see üldse tähtsust, kuna mõlemal teemal on vald käitunud mitte nii nagu võiks oodata. «Sirje on saanud korralikult haiget, ja mitte ainult Sirje, vaid kogu koolipere on saanud korralikult pihta. Oluliselt lihtsam on uut algust teha, kui seal istub uus inimene,» selgitas hoolekogu esimees. 	Postimees	Loora-Elisabet Lomp	1	68
22. november 2019, 21:34	https://tervis.postimees.ee/6832714/bangladesh-hakkab-kasvatama-toiduainet-mis-voib-paasta-vaesuses-elavate-laste-elud	Postimees	Bangladesh hakkab kasvatama toiduainet, mis võib päästa vaesuses elavate laste elud	Kuldne riis võib päästa vaesuses elavate laste elud. FOTO: Shutterstock Bangladesh on esimene riik, mis hakkab peagi kasvatama vaesuses elavate laste elusid päästvat kuldset riisi, kuid teised riigid kõhklevad. Kuldne riis arendati välja ligi 20 aasta eest, kui Šveitsi teadlased üritasid leida viisi, kuidas ennetada madala sissetulekuga perede lastel eluohtlikku vitamiinipuudust. Selleks arendati välja riis, mis sisaldab A-vitamiini, mida saab tavaliselt porgandites, spinatis ja maguskartulis sisalduvast beetakaroteenist. A-vitamiin on vajalik silmadele, immuunsüsteemile ning see mängib olulist rolli rakkude muteerumise ja kahjustuste ennetamisel. Bangladeshis kannatab ligi 20 protsenti lastest A-vitamiini puuduses ning sama olukord on Hiinas, Indias ja teistes Aasia riikides. Madala sissetulekuga perede lapsed söövad päevas vaid paar kausitäit riisi ning see ei ole piisav, et tagada lastele normaalne areng. Üks lahendus sellele probleemile on arendada riis, mis sisaldab rohkem toitaineid ja mineraale. Selleks modifitseerisid teadlased riisitaimi maisis leiduvate beetakaroteeni geenidega ning tulemuseks oli oranži pigmendiga A-vitamiini sisaldav riis. Geneetiliselt muundatud toiduainete ohutuse hindamisega tegelevad mitmed rahvusvahelised organisatsioonid ja teadlased ning seni pole täheldatud, et nende mõju tervisele erineks tavalistest toiduainetest. Kuldse riisi arendamist on arutatud nüüdseks peaaegu 20 aastat ning selle potentsiaal päästa sadu tuhandeid elusid kaalub üles võimalikud terviseriskid. Teadlased võrdlesid kuldset riisi tavaliste riisitaimedega ning ei tuvastanud mingit erinevust riisi kvaliteedis, välja arvatud A-vitamiini sisaldus. Kui kõik läheb plaanipäraselt, hakkab Bangladesh kuldset riisi tootma hiljemalt 2021. aastal. 	Tervis	PM Tervis	2	0
22. november 2019, 21:29	https://virumaateataja.postimees.ee/6833111/suur-galerii-kadrina-keskkool-rallis-cadrinal-esimeseks	Postimees	Suur galerii: Kadrina keskkool rallis CADrinal esimeseks	CADrina tänavused võitjad: Kadrina keskkooli vilistlased (vasakult) Martin Paat, Kristjan Laugesaar ja Alexander Frolov. FOTO: Ain Liiva Sel aastal kümnendat korda toimunud Kadrina keskkooli vapiüritus, IT- ja nutifestival CADrina tegi kummarduse rallispordile ja maailmameistritele Ott Tänakule ning Martin Järveojale. Arvutijoonestamise abil pidid tiimid võistlusel rekonstrueerima ralliauto. Ehkki võiduajamine oli tasavägine, jätsid Kadrina keskkooli vilistlased võidukarika koju. AutoCADi mitteametlikel meistrivõistlustel "Teel tulevikku" rallisid võiduka lõpuni neli meeskonda: finaalis olid noored Tartu ülikoolist, TalTechist, vilistlased Nõo reaalgümnaasiumist ja Kadrina keskkoolist. Ülesanne nõudis nutikatelt 3D-mudelit väntvõllist, kepsust ja kolvist. Võistlusülesande autoriks olnud Reib OÜ juhtivinsener, CADrina peakohtunik Valdar Tammin ütles, et võistlus oli üsna tasavägine. "Konkurents oli tihe. Hindasin täpsust, konkreetsust ja aega," sõnas Tammin. Esikohale tulnud Kadrina keskkooli vilistlastele pidid alla vanduma TalTechi nobenäppudest noormehed ja kolmandale kohale jäänud Nõo reaalgümnaasiumi vilistlased. Kuldsed Kadrina keskkooli vilistlased ütlesid kui ühest suust, et nad on jäänud varem teiseks ja kolmandaks. Nüüd saavutati esikoht ja tunne on super. "Emotsioonid on imelikud, võidutunnet pole lihtsalt varem olnud," sõnas IT-tudeng Alexander Frolov. Võistkonna vangivalvurist liige Martin Paat arvas, et sedakorda tõi edu see, et nad ise ei pannud endale pinget peale. "Tulime kohale ja mõtlesime, et proovime, ja andsimegi endast parima," rääkis Paat edust. Võidetud tuhandeeurose tšeki kavatsesid noormehed realiseerida juba järgmisel päeval, ostes vajalikke arvutijuppe. Esialgu aga oli neil plaan tähistada võitu korraliku õhtusöögiga. "Võitjate toit on šašlõkk," märkis tulevane arvutitehnik Kristjan Laugesaar. Seda, et tunne on hea, tunnistas ka Kadrina keskkooli direktor Arvo Pani. "Alguses oli väike värin oli sees. Aga olen rahul," lausus Pani. Kümnes CADrina õnnestus ja direktori sõnul oli oluline, et kaasa lõi kogu kool – õpetajad ja õpilased. "Sellise meeskonnaga sõidaks rallit. Absoluutselt," sõnas Pani. Imponeeriv oli ka see, et kaasatud lasteaialapsed olid rahul ja elevil. "Kasvatame järelkasvu, tulevik on infotehnoloogia päralt. Me ei tohi rongist maha jääda," rääkis Pani. Ralli suure fännina käis Kadrina keskkooli direktor välja lubaduse, et tänane päevakangelane maailmameister Ott Tänak külastab kooli detsembris. "Tahaksin, et Ott seletaks õpilastele, kuidas nii kaugele jõuda," ütles Arvo Pani. CADrinal esinenud tuntud räppar Reket tunnistas, et on üsna ükskõikne ralli suhtes, kuid Ott Tänaku tiitel on uskumatu. "Ma ei võta värsketelt saavutustelt leeki ära," lausus Reket. IT-oskustest rääkides tunnistas laulja, et suudab endale ise luua veebilehe. Õhtut juhtisid telemees Urmas Vaino ja telesaate "Rakett 69" 2017. aasta võitja Karl Vilhelm Valter. CADrina avapaugu lavastas tegevuskunstnik Katrin Essenson. Esinesid Reket ja ansambel Shanon. Kadrina keskkooli võistkonnad on CADrina võitnud kolmel korral: 2010., 2012. ja 2019. aastal. Lähemalt saab CADrinast ja Reketist lugeda teisipäevasest Virumaa Teatajast 	Virumaa Teataja	Anu Viita-Neuhaus, Ain Liiva	0	216
22. november 2019, 21:25	https://majandus24.postimees.ee/6833082/viie-aasta-parast-peab-plastpudeli-kork-jaama-avamisel-pudeli-kulge	Postimees	Viie aasta pärast peab plastpudeli kork jääma avamisel pudeli külge	Plastpudelid. Pilt on illustratiivne. FOTO: REGIS DUVIGNAU / REUTERS Alates 2024. aastast peab kõikidel plastist joogipudelitel olema kork, mis jääb pärast avamist pudeli külge, nii näeb ette eurodirektiiv, vahendas «Aktuaalne kaamera». Joogitootjatel tuleb seetõttu osta uued tootmisliinid ning see võib kergitada ka toodete hindu. Euroopa Liidu direktiivis nenditakse, et kõige rohkem reostavad randu ühekordsete joogipakendite korgid ja kaaned. Selle probleemi lahenduseks on pakutud, et «plastist valmistatud korgid ja kaaned võib turule lasta üksnes siis, kui korgid ja kaaned jäävad toote ettenähtud kasutusetapis pakendite külge». Eestis toodavad plastpudeleid enamasti suured jookide tootjad, kelle juures pudelisse villivad ka väiksemad jookide valmistajad. «See toob kõigile tootjatele kaasa muret, sest tuleb ju olemasolevad seadmed selleks ettenähtud ajaks välja vahetada. Need kulud on suhteliselt suured ja see tuleb kellelgi lõpuks kinni maksta. Üks asi on see, et ümber seadistada, aga suure tõenäosusega muutuvad olemaolevad korkimismasinad kasutuskõlbmatuks Euroopa Liidus ja sellisel juhul peab üritama need kuskile maha müüa,» lausus Värska Vesi juht Urmas Jõgeva. Tema hinnangul pole ka erilist keskkonnasäästu, sest kui tootjad on üritanud plasti vähendada, siis nüüd läheks keerukama korgi võrra jällegi pudel raskemaks. «Põhimõtteliselt peab pudelikork jääma kinnitatuks ka pärast seda, kui olete pudeli avanud ehk puudub võimalus korki kuidagi maha visata ja sellega loodust prügistada,» rääkis Eesti toiduainetööstuse liidu juht Sirje Potisepp. «Sellised tehnoloogiad ilmselt on olemas, aga praegu Eestis mul ei tule kohe meelde, et kellelgi veel oleks. Kindlasti nõuab see lisavahendeid ja lisarahastamist ettevõtte poolt ja tõstab tõenäoliselt toodete hindu,» lisas ta. Potisepa sõnul on toiduliit üritanud keskkonnaministeeriumile selgitada, et ehk on ka palju otstarbekamaid võimalusi, kuidas reostust vähendada. Tema sõnul on täiendav surve pandud tootajatele, justnagu oleksid nemad süüdi selles, et puldelikork jõuab lõpuks merre. Kuna tootmise ümberseadistamine on keeruline, antigi tootjatele lisaaega, sest ühekordse plasti direktiiv hakkab kehtima juba 2021. aastal. «Kui direktiivi läbi räägiti, siis toodi ka erinevaid numbreid välja. Ka Eestis on meie tootjad teinud teatud arvutusi ja kulud jäävad miljonitesse. Ja miks just pikk aeg, sest teatud investeeringuid tuleks nii või naa teha. On analüüsitud, et selline meede on mõislikum kui see, et üldse pudelid ära keeleta,» rääkis keskkonnaministeeriumi asekantsler Kaupo Heinma. 	Majandus	BNS	8	2
22. november 2019, 21:20	https://sport.postimees.ee/6833083/selgusid-jargmise-aasta-emi-play-off-paarid	Postimees	Selgusid järgmise aasta EMi play-off paarid	Euroopa meistrile kuuluv karikas. FOTO: SALVATORE DI NOLFI/EPA Täna loositi UEFA peakontoris Šveitsis Rahvuste liiga play-off-paarid, kelle seast selgitatakse neli paremat, kes tagavad koha tuleval aastal toimuvale Euroopa meistrivõistluste finaalturniirile. Mängud peetakse järgmisel aastal 26. ja 31. märtsil. Praeguseks on selged 20 riiki, kelle rahvuskoondised pääsesid edasi EM-valiksarja kaudu. Play-off-seeriad on jagatud nelja tugevusastmesse. A-divisjonis asuvad võistlustulle Bulgaaria, Ungari, Island ja Rumeenia. Islandlased võõrustavad rumeenlasi ning Bulgaariale sõidab külla Ungari. Paaride võitjad selgitavad esimese edasipääseja, kas Bulgaarias või Ungaris. B-divisjonis heitlevad pileti eest EM-finaalturniirile Bosnia ja Hertsegoviina, Põhja-Iirimaa, Slovakkia ning Iirimaa. Põhja-Iirimaa sõidab külla Bosnia ja Hertsegoviinale ning teise finalisti selgitavad Slovakkia ja Iirimaa. Finaal B-tasemel toimub olenevalt tulemustest kas Bosnia ja Hertsegoviinas või Põhja-Iirimaal. C-divisjonis lähevad vastamisi Šotimaa, kes võõrustab koduväljakul Iisraeli ning Norra, kellele astub vastu Serbia. Otsustav lahing peetakse kas Norras või Serbias. Kõige nõrgemas ehk D-divisjonist pääseb kindlasti finaalturniirile EMi debütant, sest ükski osalejatest pole varem tõotatud maale pääsenud. Seega võib neid mänge pidada osalevate riikide jalgpalliajaloo tähtsamateks kohtumisteks. Gruusia võtab Thbilisis vastu äsja Eesti jalgpallikoondisega maid jaganud Valgevene koondise ning teises paaris asuvad kemplema Põhja-Makedoonia ja Kosovo. Viimane finaal toimub kas Minskis või Thbilisis. 31. märtsiks võib selguda tõsiasi, et esimest korda EMi ajaloos võivad jõuda finaalturniirile kõik Põhjamaad (Soome, Rootsi, Norra, Taani, Island). Nendest kolm – Soome, Rootsi ja Taani – on juba oma tööga filigraanselt hakkama saanud. Seda soodustab ka uus süsteem, mille järgi osaleb lõppvõistlusel koguni 24 riiki. 	Sport	Postimees Sport	0	0
22. november 2019, 21:02	https://maailm.postimees.ee/6833068/merkeli-cdu-juht-on-valmis-lahkuma-kui-partei-teda-ei-toeta	Postimees	Merkeli CDU juht on valmis lahkuma, kui partei teda ei toeta	Annegret Kramp-Karrenbauer. FOTO: JOHN MACDOUGALL / AFP Saksa kantsleri Angela Merkeli Kristlik-Demokraatliku Liidu (CDU) esimees Annegret Kramp-Karrenbauer ütles reedel parteikongressil, et on valmis ametist lahkuma, kui erakond teda ei toeta. "Kui arvate, et Saksamaa, mida mina soovin ei ole see, mida soovite teie, siis peame selle lõpetama. Siin, nüüd ja täna," ütles Kramp-Karrenbauer talle parteijuhina osaks saanud kriitikale vastates. "Seista siin parteina ja öelda, et kõik, mis me viimased 14 aastat tegime oli vale, ei ole hea valimisstrateegia," hoiatas ta CDU aastakongressi algul. Kommentaar oli varjatud rünnak Friedrich Merzi pihta, kes läinud aasta juhivalimistel Kramp-Karrenbauerile napilt alla jäi. Merz on viimastel nädalatel taas tähelepanu tõmmanud, nimetades CDU koalitsioonivalitsust kohutavaks ja Merkelit nõrgaks juhiks. Merkel hoidus sõnelusest ja ärgitas erakonda ühtsusele. Merkeli neljanda ametiaja lõpu lähenedes on CDU proovinud vaigistada sisetülisid kantsleri pärandi ja erakonna tuleviku pärast. Kasvanud on ka välissurve, kuivõrd erakond on kaotanud valijaid rohelistele ja paremäärmuslikule Alternatiiv Saksamaale (AfD). Kramp-Karrenbaueri mainet on kahjustanud muu hulgas äpardunud sõnavõtud. Aprillis pälvis ta laialdase hukkamõistu, kui viskas nalja transsooliste tualettide üle. Kuu hiljem pahandas ta juutuubereid interneti sõnavabaduse kritiseerimise tõttu. "Ma ei tea paljusid inimesi, keda tema juhtimisstiil veenab," ütles CDU poliitik Hans-Jörn Arp kolmapäeval uudisteagentuurile DPA. Merzist on saanud parteiliikmete seas populaarseim kandidaat Merkeli mantlipärijaks järgmistel valimistel. Tavaliselt on CDU juhatus kandidaatide valikut koos oma Baieri sõsarpartei CSU-ga suletud uste taga arutanud, aga nüüd tehakse üleskutseid, et selles saaks osaleda terve erakond. 	Maailm	AFP / BNS	0	0
22. november 2019, 20:57	https://virumaateataja.postimees.ee/6833088/kadrina-avas-korvpalli-esiliigas-voiduarve-tamsalu-taiendas-enda-oma	Postimees	Kadrina avas korvpalli esiliigas võiduarve, Tamsalu täiendas enda oma	Tamsalu Los Toros/TalTech tõusis tänu viiendale võidule esiliiga turniiritabelis esikolmikusse. FOTO: Rainer Tops Eesti esiliiga korvpalli meistrivõistlustel saatis reede õhtul edu mõlemat Lääne-Viru meeskonda. Kui Kadrina Karud avasid uue peatreeneri Aivar Kuusmaa debüütmängus võiduarve, siis Tamsalu Los Toros/TalTech kirjutas tabelisse võidupunktid juba viiendat korda. Kadrinlased suutsid ülimalt tasavägise mängu esiliiga paremikku kuuluva KK Viimsi/Noto vastu kallutada kodusaalis enda kasuks 78:74. Poolajaks juhtisid külalised 31:30. "Nagu juba varem mainisin, siis esiliiga on läinud professionaalsemaks ja pean ütlema, et mõlema poole pealt käis päris füüsiline ning agressiivne andmine," kõneles Aivar Kuusmaa. "Hea meel, et poisid võitsid ja said natuke head emotsiooni. Saal oli rahvast täis – tore on, et saame kellelegi mängida. Üle pika aja mul mängu viimastel minutitel natukene isegi käed värisesid." Tubli panuse andsid Karude edusse sarnaselt juhendajaga esimest korda meeskonda esindanud ameeriklased Austin Dwight Wrighten ja De Vante Rashawn Young. Esimene viskas 22 punkti ja võttis 11 lauapalli, teine skooris 13 punkti ja jagas kaaslastele 11 korvisöötu. Kohtumise närvesöövatel lõpusekunditel külmavereliselt ja tulemuslikult tegutsenud Kadrina tiimi kapten Allan Ehte lisas 16 punkti, Lauri Mets 11 punkti ja üheksa lauapalli. Nädala pärast ootab Karusid ees tõsine duell teise nimeka treeneri, Tiit Soku juhendamisel mängiva Betoonimeister/SK Nord/Cramo tiimiga. Aivar Kuusmaa lausus, et ei maksaks vastandada Kuusmaad ja Sokku, vaid pigem ikka Betoonimeistrit ja Karusid. "Nojah, kahjuks sellest [kahe korvpallilegendi vastandamisest] ei saa lahti," lisas ta. Kadrina Karud - KK Viimsi/Noto mängu protokoll Kadrina Karude selle hooaja esimesest võidumängust Kadrina spordikeskuses tuli osa saama taas korralik rahvahulk. FOTO: Kirke Külmhallik Los Toros oli Betoonimeister/SK Nord/Cramo tiimist nende koduplatsil parem 91:65 (44:26). Tamsalu meeskonna esindaja Rainer Tops lausus, et võit tuli küll skoori mõttes kindlalt, aga parandamisruumi on neil endiselt kõvasti. Marcus Neiland viskas võitjate kasuks 17 ja Eric Schmalz 15 punkti. Rait Tammet sepistas 12 punkti ja 12 lauapalliga kaksikduubli. Kaotajatest ainsana kahekohalise punktiarve kogunud Siim Lauri arvele kanti 28 punkti. Betoonimeister/SK Nord/Cramo - Tamsalu Los Toros/TalTech mängu protokoll Kadrina Karud tõusid tänu seitsmest mängust saadud esimesele võidule turniiritabelis eelviimasele, üheteistkümnendale kohale. Samal ajal KA Tallinna Kalev/TLÜ 95:67 paremust tunnistanud KK HITO/BC Karjamaa on seitsme kaotusega viimane. Tamsalu Los Toros/TalTech kerkis viie võidu ja kolme kaotusega keskmike hulgast esikolmikusse. 	Virumaa Teataja	Margus Martin	0	0
22. november 2019, 20:38	https://tervis.postimees.ee/6832571/need-on-maailma-koige-vastuolulisemad-toidud	Postimees	Need on maailma kõige vastuolulisemad toidud	Mitmed toidud teevad rohkem kahju kui kasu. FOTO: Shutterstock Järjest enam pööratakse tähelepanu sellele, millised toidud säästavad keskkonda ja tervist. ÜRO kliimaraporti hinnangul on inimese toitumine üks peamisi viise, kuidas planeedi ja inimese tervist positiivselt mõjutada. Suurbritannia teadlased koostasid nimekirja toitudest, millel on suur mõju elukeskkonnale. 	Tervis	Lilian Laanepere	1	67
22. november 2019, 20:27	https://maailm.postimees.ee/6833053/trump-minuta-oleks-hongkong-14-minutiga-maatasa-tehtud	Postimees	Trump: minuta oleks Hongkong 14 minutiga maatasa tehtud	President Donald Trump. FOTO: Pete Marovich / ZUMAPRESS.com USA president Donald Trump ütles reedel, et ilma temata oleks Hiina sõjavägi Hongkongi 14 minutiga maatasa teinud. Trumpi sõnul ei saatnud Hiina president Xi Jinping sõdureid demokraatiameelset protesti vaigistama vaid sel põhjusel, et ta palus seda mitte teha. «Kui polnuks mind, oleks Hongkong 14 minutiga maatasa tehtud,» väitis Trump usutluses Fox Newsile. «Xi'l on miljon sõdurit Hongkongi piiril, kes ei lähe sinna, sest ma palusin talt: «Palun ära tee seda. See oleks suur viga. Sellel oleks tohutult halb mõju kaubandusleppele»,» kirjeldas Trump. Trump kaalub, kas kiita heaks USA Kongressis vastuvõetud seadus, millega toetatakse Hongkongi demokraatiameelset liikumist või mitte. Trumpilt küsiti selle kohta ka intervjuus. «Ma ütlen teile, et peame toetama Hongkongi, kuid ma toetan ka president Xi'd. Ta on mu sõber, ta on uskumatu isik,» sõnas Trump. «Ma tahaksin näha, et nad leiavad lahenduse. Me peame nägema, kuidas nad lahenduse leiavad,» lisas ta. Hongkongis on kestnud meeleavaldused Pekingi-meelse valitsuse ja õiguste kärpimise vastu juba kuus kuud. Meeleavaldustel süüdistatakse vägivallas nii protestijaid kui politseijõude. USA ja Hiina esindajad on «potentsiaalselt väga lähedal» kokkuleppele kaubandusvaidluses, lisas USA riigipea. 	Maailm	AFP / BNS	0	0
22. november 2019, 20:05	https://maailm.postimees.ee/6833043/kambodza-liider-tervitas-usa-d-parast-kirja-trumpilt	Postimees	Kambodža liider tervitas USA-d pärast kirja Trumpilt	Donald Trump. FOTO: Evan Vucci/AP/Scanpix Baltics Kambodža peaminister Hun Sun väljendas oma pöördumises sooja suhtumist USA-sse, mis on olnud Kambodža valitsusjuhi suhtes kriitiline. Ühendriikide president Donald Trump oli saatnud Hun Senile 1. novembril lepitavas toonis kirja, millest koostatud kokkuvõtte postitas Hun Sen Facebooki. Samuti kirjeldas ta postituses, kuidas ta väljendas Kambodža sooja suhtumist Ühendriikidesse ka kohtumisel USA suursaadiku Patrick Murphyga. Washington on olnud kaua kriitiline Hun Seni väidetavate inimõigusrikkumiste suhtes ning võttis karmima hoiaku pärast Kambodža ülemkohtu otsust saata laiali riigi ainus suurem opositsioonipartei, mis tagas Hun Seni erakonnale võidu 2018. aasta üldvalimistel. Trumpi kirjas, mis lekkis reedel ka meediasse, toob ta esile varasemad positiivsed elemendid USA-Kambodža suhetes ning möönab «raskusi» viimastel aastatel. Ühendriigid «peavad lugu Kambodža rahva suveräänsest tahtest ning me ei taotle režiimivahetust,» ütles Trump. Hun Sen on olnud võimul 34 aastat ja kavatseb enda sõnul riiki valitseda 2028. aastani. Trump ütles kirjas, et valitsusjuhil «tuleb panna Kambodža taas demokraatliku valitsemise rajale». «Esimese sammuna ma loodan, et sa hindaksid ümber teatud otsused, mille sinu valitsus on langetanud, mis USA arvates seavad Kambodža Kuningriigi pikaajalise suveräänsuse, stabiilsuse ja majandusliku arengu suurde ohtu,» seisis Trumpi kirjas. Kambodža suur poliitiline ja majanduslik toetaja on Hiina, kel on riigiga ka üha tihedamad sõjalised sidemed. Hun Sen toetas USA 2016. aasta presidendivalimiste eel avalikult vabariiklasest Trumpi demokraadist Hillary Clintoni vastu. Hun Sen lisas oma Facebooki postituses, et võttis vastu Trumpi varasema kutse visiidile, mis oli esitatud Kagu-Aasia ühenduse ASEAN liikmesriikide liidritele. 	Maailm	BNS	0	0
22. november 2019, 20:00	https://sport.postimees.ee/6833039/beitostoleni-sprindis-voidutses-toeline-ullataja	Postimees	Beitostöleni sprindis võidutses tõeline üllataja	Ane Appelkvist Stenseth. FOTO: JOHANNA LUNDBERG/imago/Bildbyran Täna anti avapauk Norra murdmaasuusatajate traditsioonilisele hooaja avavõistlusele Beitostölenis, kus sõideti klassikasprinte. Meeste arvestuses võidutses Erik Valnes ja naistest üllatuslikult Ane Appelkvist Stenseth. 24-aastane Stenseth edestas finaalsõidus maailmameister Maiken Caspersen Fallat, olles kaasmaalasest 1,2 sekundi võrra parem. Kolmandale kohale platseerus ameeriklanna Sophie Caldwell (+2,37). Stensethi triumfi muudab üllatuslikuks just see, et norralanna polnud täiskasvanute seas seni ühtegi võitu saanud. Möödunud talvel teenis ta esimesed MK-punktid Saksamaal, kui sai Dresdeni sprindis 17. koha. Meeste arvestuses napsas esikoha U23 vanuserühma maailmameister Erik Valnes. 23-aastasele atleedile järgnesid koondisekaaslane Pal Trøan Aune (+0,35) ning prantslane Lucas Chanavat (+1,12). MK-sarja üldvõitja Johannes Hösflot Kläbo piirdus seekord viienda kohaga. Laupäeval on Beitostölenis kavas naiste 10 km ja meeste 15 km klassikasõit ning pühapäeval naiste 10 km ja meeste 15 km vabatehnikasõit. 	Sport	Postimees Sport	0	5
